### ISSUE TITLE
Bond receiving Error

### ISSUE THREAD

**Issue by hi-flyer** [ssmall/bondhome-mqtt#5]
This driver has been working perfectly until recently. It now receives the the following message on request to change the blinds.
Not acking message due to error executing action: expected 2xx response but got: &{400 Bad Request 400 HTTP/1.1 1 1 map[Bond-Flags:[4] Content-Length:[54] Content-Type:[application/json; charset=utf-8]] 0xc00020b280 54 [] false false map[] 0xc0001d2600 <nil>}

Driver is on Ubuntu 20.04. I have update the bond hub to version 3.19 (in an attempt to fix this problem (but it did not fix). have restarted the Driver multiple times (but no sucess on actuating the blinds). I have also rebooted the server the driver is running on (but no success there either).
Using the bond app on my phone, it actuates the blinds as requested. Has something changed such that the driver is no longer working correctly or has my Bond hub  likely have a problem?

**Comment by hi-flyer** [comment]
log message on startup:
2022/09/13 09:35:50 Establishing connection to MQTT broker @ tcp://localhost:1883 using client ID "LINUX-E4310-3"
2022/09/13 09:35:50 Connected to MQTT broker 
2022/09/13 09:35:50 Connected to broker @  tcp://localhost:1883
2022/09/13 09:35:50 Discovered device with id "19aa5d53": &bondhome.Device{Name:"Front Door", Type:"MS", Location:"Kitchen", Actions:[]string{"Close", "Hold", "Open", "Pair", "Preset", "Stop", "ToggleOpen"}}
2022/09/13 09:35:50 Subcribed to topic bondhome/devices/19aa5d53/Pair
2022/09/13 09:35:50 Subcribed to topic bondhome/devices/19aa5d53/ToggleOpen
2022/09/13 09:35:50 Subcribed to topic bondhome/devices/19aa5d53/Preset
2022/09/13 09:35:50 Subcribed to topic bondhome/devices/19aa5d53/Close
2022/09/13 09:35:50 Subcribed to topic bondhome/devices/19aa5d53/Hold
2022/09/13 09:35:50 Subcribed to topic bondhome/devices/19aa5d53/Stop
2022/09/13 09:35:50 Subcribed to topic bondhome/devices/19aa5d53/Open
2022/09/13 09:35:50 Discovered device with id "1407b88f": &bondhome.Device{Name:"kitchen", Type:"MS", Location:"Kitchen", Actions:[]string{"Close", "Hold", "Open", "Pair", "Preset", "Stop", "ToggleOpen"}}
2022/09/13 09:35:50 Subcribed to topic bondhome/devices/1407b88f/Close
2022/09/13 09:35:50 Subcribed to topic bondhome/devices/1407b88f/ToggleOpen
2022/09/13 09:35:50 Subcribed to topic bondhome/devices/1407b88f/Hold
2022/09/13 09:35:50 Subcribed to topic bondhome/devices/1407b88f/Pair
2022/09/13 09:35:50 Subcribed to topic bondhome/devices/1407b88f/Preset
2022/09/13 09:35:50 Subcribed to topic bondhome/devices/1407b88f/Open
2022/09/13 09:35:50 Subcribed to topic bondhome/devices/1407b88f/Stop
2022/09/13 09:35:50 Exiting due to setupDeviceActionHandlers error:error setting up listeners: expected 2xx response but got: &{404 Not Found 404 HTTP/1.1 1 1 map[Bond-Flags:[4] Content-Length:[0]] {} 0 [] false false map[] 0xc00011e000 <nil>}

**Comment by ssmall** [comment]
Hi, thanks for your report! I'm not 100% confident without additional debug information, but based on the context you provided I'm going to make an educated guess that the latest firmware breaks API compatibility with this tool.

To be completely transparent: as the original author of this repo, I have barely touched it in years and it's actually surprising to me that it has still been working at all.

I am going to spend a bit of time looking into what might be causing your error; if it's a simple fix then I might be able to get it working (will probably need your helping testing a fix as I do not currently have my own working Bond bridge). If it's something deeper or more complicated, I can't promise that I will be able to get a fix. I'll let you know what I find.

As always, contributions are welcome! If you are able to reproduce the issue yourself and want to send a PR with a fix, I would be happy to review and accept it.

**Comment by hi-flyer** [comment]
I have gone to the bond code and a response to the curl command is:
curl -H "BOND-Token: xxxxxxxxxxxx" -i http://192.168.1.235/v2/devices/yyyyyyyy
HTTP/1.1 200 OK
BOND-Flags: 4
Content-Length: 281
Content-Type: application/json; charset=utf-8

{"name":"kitchen","type":"MS","location":"Kitchen","template":"RMS12","actions":["Close","Hold","Open","Pair","Preset","Stop","ToggleOpen"],"_":"6a8f74ee","__":"b2860ef3","commands":{"_":"48729619"},"state":{"_":"5e1a1565"},"properties":{"_":"faeefabd"},"skeds":{"_":"00000000"}}

I am thinking they added some stuff that is confusing the decode but I do not program in go and have not figured out where the decoding of the line happens.

**Comment by ssmall** [comment]
I have added some extra logging in the latest commit. Can you try running from this commit? https://github.com/ssmall/bondhome-mqtt/commit/760e22a984165d4e1a741c247b9ff1367c0bf2c4

It is also available as a Docker image at `ghcr.io/ssmall/bondhome-mqtt@sha256:5ed673ba2fa351918afe67fe0c5693ced8a8d5936da865f919a62825c25d304c`

**Comment by hi-flyer** [comment]
Ok I have started docker. I have the latest docker image but docker will says it wants a container. Not sure how the original version was running but it was not thru docker
I used go run main.go ...

**Comment by hi-flyer** [comment]
@ssmall  My software was on an old version, so i update whole thing to our latest but still get the error. the following is the output from the new version. (I replaced my old version below)

go run main.go -broker tcp://localhost:1883 -bridge 192.168.1.235 -token xxxxxxxxxxxxxxxx
go: downloading github.com/eclipse/paho.mqtt.golang v1.4.1
go: downloading golang.org/x/sync v0.0.0-20220907140024-f12130a52804
go: downloading golang.org/x/net v0.0.0-20220909164309-bea034e7d591
go: downloading github.com/gorilla/websocket v1.5.0
F0913 16:01:02.370663   74992 main.go:51] Exiting due to error:error setting up listeners: expected 2xx response but got: &{404 Not Found 404 HTTP/1.1 1 1 map[Bond-Flags:[4] Content-Length:[0]] {} 0 [] false false map[] 0xc00016a000 <nil>}
goroutine 1 [running]:
github.com/golang/glog.stacks(0x0)
	/home/beckstein/go/pkg/mod/github.com/golang/glog@v1.0.0/glog.go:769 +0x8a
github.com/golang/glog.(*loggingT).output(0x90d940, 0x3, 0xc0000120e0, {0x7b6787?, 0x2?}, 0x76f338?, 0x0)
	/home/beckstein/go/pkg/mod/github.com/golang/glog@v1.0.0/glog.go:720 +0x46e
github.com/golang/glog.(*loggingT).printDepth(0x7ffcb8444af7?, 0x14?, 0x76e0a0?, {0xc000121f08, 0x2, 0x2})
	/home/beckstein/go/pkg/mod/github.com/golang/glog@v1.0.0/glog.go:646 +0xee
github.com/golang/glog.(*loggingT).print(...)
	/home/beckstein/go/pkg/mod/github.com/golang/glog@v1.0.0/glog.go:637
github.com/golang/glog.Fatal(...)
	/home/beckstein/go/pkg/mod/github.com/golang/glog@v1.0.0/glog.go:1128
main.main()
	/home/beckstein/bondhome-mqtt-master/main.go:51 +0x4a5
exit status 255

**Comment by ssmall** [comment]
@hi-flyer can you add `-logtostderr` and `-v 1` to your command line arguments? That will get us some more detailed logs.

**Comment by hi-flyer** [comment]
@ssmall  did I do it wrong. do not see the earlier diagnostics

go run main.go -logtostderr -v 1 -broker tcp://localhost:1883 -bridge 192.168.1.235 -token xxxxxxxxxxxxxx
I0913 16:16:07.461871   77174 mqtt.go:24] Establishing connection to MQTT broker @ tcp://localhost:1883 using client ID "LINUX-E4310-3"
I0913 16:16:07.463487   77174 main.go:45] Connected to broker @  tcp://localhost:1883
I0913 16:16:07.567158   77174 main.go:116] Got device IDs:  [__ 1407b88f 19aa5d53]
I0913 16:16:07.766548   77174 main.go:127] Discovered device with id "19aa5d53": &bondhome.Device{Name:"Front Door", Type:"MS", Location:"Kitchen", Actions:[]string{"Close", "Hold", "Open", "Pair", "Preset", "Stop", "ToggleOpen"}}
I0913 16:16:07.767636   77174 main.go:165] Subcribed to topic bondhome/devices/19aa5d53/ToggleOpen
I0913 16:16:07.767741   77174 main.go:165] Subcribed to topic bondhome/devices/19aa5d53/Pair
I0913 16:16:07.767768   77174 main.go:165] Subcribed to topic bondhome/devices/19aa5d53/Preset
I0913 16:16:07.767886   77174 main.go:165] Subcribed to topic bondhome/devices/19aa5d53/Hold
I0913 16:16:07.767862   77174 main.go:165] Subcribed to topic bondhome/devices/19aa5d53/Close
I0913 16:16:07.768340   77174 main.go:165] Subcribed to topic bondhome/devices/19aa5d53/Open
I0913 16:16:07.768341   77174 main.go:165] Subcribed to topic bondhome/devices/19aa5d53/Stop
I0913 16:16:07.872912   77174 main.go:127] Discovered device with id "1407b88f": &bondhome.Device{Name:"kitchen", Type:"MS", Location:"Kitchen", Actions:[]string{"Close", "Hold", "Open", "Pair", "Preset", "Stop", "ToggleOpen"}}
I0913 16:16:07.874544   77174 main.go:165] Subcribed to topic bondhome/devices/1407b88f/ToggleOpen
I0913 16:16:07.874615   77174 main.go:165] Subcribed to topic bondhome/devices/1407b88f/Open
I0913 16:16:07.875404   77174 main.go:165] Subcribed to topic bondhome/devices/1407b88f/Close
I0913 16:16:07.875406   77174 main.go:165] Subcribed to topic bondhome/devices/1407b88f/Preset
I0913 16:16:07.875485   77174 main.go:165] Subcribed to topic bondhome/devices/1407b88f/Pair
I0913 16:16:07.875522   77174 main.go:165] Subcribed to topic bondhome/devices/1407b88f/Hold
I0913 16:16:07.875526   77174 main.go:165] Subcribed to topic bondhome/devices/1407b88f/Stop
F0913 16:16:07.875617   77174 main.go:51] Exiting due to error:error setting up listeners: expected 2xx response but got: &{404 Not Found 404 HTTP/1.1 1 1 map[Bond-Flags:[4] Content-Length:[0]] {} 0 [] false false map[] 0xc000228000 <nil>}
exit status 255

**Comment by ssmall** [comment]
This is the culprit:
```
I0913 16:16:07.567158 77174 main.go:116] Got device IDs: [__ 1407b88f 19aa5d53]
```

it looks like the API has started returning an entry for `__`. The code only screens for `_` at the moment, so this should be a simple fix. I will update here when I have a fix for you to try out.

**Comment by hi-flyer** [comment]
Thank you for the quick response. This software has worked great and I really appreciate your work.

**Comment by ssmall** [comment]
Ok, I have pushed a fix. Could you please test that it works for you now when you use the code from the latest commit https://github.com/ssmall/bondhome-mqtt/commit/7c20bf0048421fbf417d2af0d37c7d7040fba891 ?

**Comment by hi-flyer** [comment]
@ssmall 
go run main.go -broker tcp://localhost:1883 -bridge 192.168.1.235 -token xxxxxxxxxxxxx
F0913 16:58:47.111545   82380 main.go:51] Exiting due to error:could not get devices from bridge: error executing HTTP request: Get "192.168.1.235/v2/devices": unsupported protocol scheme ""
goroutine 1 [running]:
github.com/golang/glog.stacks(0x0)
	/home/beckstein/go/pkg/mod/github.com/golang/glog@v1.0.0/glog.go:769 +0x8a
github.com/golang/glog.(*loggingT).output(0x90d940, 0x3, 0xc0000b4070, {0x7b67a7?, 0x2?}, 0x76f358?, 0x0)
	/home/beckstein/go/pkg/mod/github.com/golang/glog@v1.0.0/glog.go:720 +0x46e
github.com/golang/glog.(*loggingT).printDepth(0x7ffc16d03af8?, 0x14?, 0x76e0c0?, {0xc0000d7f08, 0x2, 0x2})
	/home/beckstein/go/pkg/mod/github.com/golang/glog@v1.0.0/glog.go:646 +0xee
github.com/golang/glog.(*loggingT).print(...)
	/home/beckstein/go/pkg/mod/github.com/golang/glog@v1.0.0/glog.go:637
github.com/golang/glog.Fatal(...)
	/home/beckstein/go/pkg/mod/github.com/golang/glog@v1.0.0/glog.go:1128
main.main()
	/home/beckstein/bondhome-mqtt-master/main.go:51 +0x4a5
exit status 255

beckstein@LINUX-E4310-3:~/bondhome-mqtt-master$ go run main.go -v 1 -logtostderr -broker tcp://localhost:1883 -bridge 192.168.1.235 -token xxxxxxxxxxxxxxxx
I0913 16:59:23.869649   82493 mqtt.go:24] Establishing connection to MQTT broker @ tcp://localhost:1883 using client ID "LINUX-E4310-3"
I0913 16:59:23.871761   82493 main.go:45] Connected to broker @  tcp://localhost:1883
F0913 16:59:23.871904   82493 main.go:51] Exiting due to error:could not get devices from bridge: error executing HTTP request: Get "192.168.1.235/v2/devices": unsupported protocol scheme ""
exit status 255
beckstein@LINUX-E4310-3:~/bondhome-mqtt-master$ go run main.go -v 1 -logtostderr -broker tcp://localhost:1883 -bridge 192.168.1.235 -token 47f76d936cb9bc8e
I0913 17:00:09.295525   82980 mqtt.go:24] Establishing connection to MQTT broker @ tcp://localhost:1883 using client ID "LINUX-E4310-3"
I0913 17:00:09.297580   82980 main.go:45] Connected to broker @  tcp://localhost:1883
F0913 17:00:09.297710   82980 main.go:51] Exiting due to error:could not get devices from bridge: error executing HTTP request: Get "192.168.1.235/v2/devices": unsupported protocol scheme ""
exit status 255

**Comment by hi-flyer** [comment]
Sorry, have appointment I have to go to. Will check if update in the morning.

**Comment by ssmall** [comment]
Sorry about that! My fix introduced a different bug. Should now be fixed in commit https://github.com/ssmall/bondhome-mqtt/commit/db86d24fb8d7988dc9ec9f53d81b8f11940e8966

**Comment by hi-flyer** [comment]
@ssmall seems there is some more places. When I send a message on mqtt, I am and monitoring journalctl, I get the following error. startbondmqtt is the bash script I start the bondhome driver with. the last 4 lines are where I sent a message bondhome/devices/1407b88f/Open True to the broker

sudo journalctl  -u bondhome-mqtt
Sep 14 06:54:32 LINUX-E4310-3 startbondmqtt[4747]: 2022/09/14 06:54:32 Establishing connection to MQTT broker @ tcp://localhost:1883 using client ID "LINUX-E4310-3"
Sep 14 06:54:32 LINUX-E4310-3 startbondmqtt[4747]: 2022/09/14 06:54:32 Connected to broker @  tcp://localhost:1883
Sep 14 06:54:33 LINUX-E4310-3 startbondmqtt[4747]: 2022/09/14 06:54:33 Subcribed to topic bondhome/devices/1407b88f/ToggleOpen
Sep 14 06:54:33 LINUX-E4310-3 startbondmqtt[4747]: 2022/09/14 06:54:33 Subcribed to topic bondhome/devices/1407b88f/Close
Sep 14 06:54:33 LINUX-E4310-3 startbondmqtt[4747]: 2022/09/14 06:54:33 Subcribed to topic bondhome/devices/1407b88f/Stop
Sep 14 06:54:33 LINUX-E4310-3 startbondmqtt[4747]: 2022/09/14 06:54:33 Subcribed to topic bondhome/devices/1407b88f/Preset
Sep 14 06:54:33 LINUX-E4310-3 startbondmqtt[4747]: 2022/09/14 06:54:33 Subcribed to topic bondhome/devices/1407b88f/Pair
Sep 14 06:54:33 LINUX-E4310-3 startbondmqtt[4747]: 2022/09/14 06:54:33 Subcribed to topic bondhome/devices/1407b88f/Hold
Sep 14 06:54:33 LINUX-E4310-3 startbondmqtt[4747]: 2022/09/14 06:54:33 Subcribed to topic bondhome/devices/1407b88f/Open
Sep 14 06:54:33 LINUX-E4310-3 startbondmqtt[4747]: 2022/09/14 06:54:33 Subcribed to topic bondhome/devices/19aa5d53/Open
Sep 14 06:54:33 LINUX-E4310-3 startbondmqtt[4747]: 2022/09/14 06:54:33 Subcribed to topic bondhome/devices/19aa5d53/ToggleOpen
Sep 14 06:54:33 LINUX-E4310-3 startbondmqtt[4747]: 2022/09/14 06:54:33 Subcribed to topic bondhome/devices/19aa5d53/Hold
Sep 14 06:54:33 LINUX-E4310-3 startbondmqtt[4747]: 2022/09/14 06:54:33 Subcribed to topic bondhome/devices/19aa5d53/Close
Sep 14 06:54:33 LINUX-E4310-3 startbondmqtt[4747]: 2022/09/14 06:54:33 Subcribed to topic bondhome/devices/19aa5d53/Stop
Sep 14 06:54:33 LINUX-E4310-3 startbondmqtt[4747]: 2022/09/14 06:54:33 Subcribed to topic bondhome/devices/19aa5d53/Pair
Sep 14 06:54:33 LINUX-E4310-3 startbondmqtt[4747]: 2022/09/14 06:54:33 Subcribed to topic bondhome/devices/19aa5d53/Preset
Sep 14 06:59:48 LINUX-E4310-3 startbondmqtt[4747]: E0914 06:59:48.815350    4747 main.go:158] Not acking message due to error executing action: expected 2xx response but got: &{40>
Sep 14 06:59:55 LINUX-E4310-3 startbondmqtt[4747]: E0914 06:59:55.426953    4747 main.go:158] Not acking message due to error executing action: expected 2xx response but got: &{40>
Sep 14 07:03:20 LINUX-E4310-3 startbondmqtt[4747]: E0914 07:03:20.050384    4747 main.go:158] Not acking message due to error executing action: expected 2xx response but got: &{40>
Sep 14 07:05:23 LINUX-E4310-3 startbondmqtt[4747]: E0914 07:05:23.225748    4747 main.go:158] Not acking message due to error executing action: expected 2xx response but got: &{

**Comment by hi-flyer** [comment]
in the above I add the logging lines back in. without the logging lines and just starting the program in a terminal I get:
go run main.go -broker tcp://localhost:1883 -bridge 192.168.1.235 -token xxxxxxxxxxxx
E0914 07:34:22.857885   11120 main.go:158] Not acking message due to error executing action: expected 2xx response but got: &{400 Bad Request 400 HTTP/1.1 1 1 map[Bond-Flags:[4] Content-Length:[50] Content-Type:[application/json; charset=utf-8]] 0xc000304240 50 [] false false map[] 0xc0001f2300 <nil>}
^Cbeckstein@LINUX-E4310-3:~/bondhome-mqttnano main.go 
PS my line 158 is your line 155 due to commented log lines

**Comment by ssmall** [comment]
can you please make sure to run with `-v=1`? That will provide extra logging that is necessary to debug this issue.

**Comment by hi-flyer** [comment]
@ssmall 
no modifications to your code. I get the following
go run main.go -v=1 -broker tcp://localhost:1883 -bridge 192.168.1.235 -token xxxxxxxxxxxxxxx
E0914 11:33:29.079687   39390 main.go:155] Not acking message due to error executing action: expected 2xx response but got: &{400 Bad Request 400 HTTP/1.1 1 1 map[Bond-Flags:[4] Content-Length:[50] Content-Type:[application/json; charset=utf-8]] 0xc0000b3300 50 [] false false map[] 0xc00012c300 <nil>}

**Comment by ssmall** [comment]
sorry, to clarify: you should be continuing to use both the `-logtostderr` and `-v=1` flags while we're debugging; otherwise, important logs will not appear.

**Comment by hi-flyer** [comment]
@ssmall 
with command I sent
beckstein@LINUX-E4310-3:~/bondhome-mqtt$ go run main.go -logtostderr -v=1 -broker tcp://localhost:1883 -bridge 192.168.1.235 -token xxxxxxxxxxxxxxxx
I0914 11:56:26.575831   42832 mqtt.go:24] Establishing connection to MQTT broker @ tcp://localhost:1883 using client ID "LINUX-E4310-3"
I0914 11:56:26.577440   42832 main.go:45] Connected to broker @  tcp://localhost:1883
I0914 11:56:26.661779   42832 main.go:116] Got device IDs:  [1407b88f 19aa5d53]
I0914 11:56:26.787719   42832 main.go:127] Discovered device with id "19aa5d53": &bondhome.Device{Name:"Front Door", Type:"MS", Location:"Kitchen", Actions:[]string{"Close", "Hold", "Open", "Pair", "Preset", "Stop", "ToggleOpen"}}
I0914 11:56:26.789015   42832 main.go:165] Subcribed to topic bondhome/devices/19aa5d53/ToggleOpen
I0914 11:56:26.789023   42832 main.go:165] Subcribed to topic bondhome/devices/19aa5d53/Preset
I0914 11:56:26.789155   42832 main.go:165] Subcribed to topic bondhome/devices/19aa5d53/Close
I0914 11:56:26.789162   42832 main.go:165] Subcribed to topic bondhome/devices/19aa5d53/Open
I0914 11:56:26.789341   42832 main.go:165] Subcribed to topic bondhome/devices/19aa5d53/Hold
I0914 11:56:26.789344   42832 main.go:165] Subcribed to topic bondhome/devices/19aa5d53/Pair
I0914 11:56:26.789435   42832 main.go:165] Subcribed to topic bondhome/devices/19aa5d53/Stop
I0914 11:56:26.876038   42832 main.go:127] Discovered device with id "1407b88f": &bondhome.Device{Name:"kitchen", Type:"MS", Location:"Kitchen", Actions:[]string{"Close", "Hold", "Open", "Pair", "Preset", "Stop", "ToggleOpen"}}
I0914 11:56:26.877214   42832 main.go:165] Subcribed to topic bondhome/devices/1407b88f/ToggleOpen
I0914 11:56:26.877214   42832 main.go:165] Subcribed to topic bondhome/devices/1407b88f/Hold
I0914 11:56:26.877309   42832 main.go:165] Subcribed to topic bondhome/devices/1407b88f/Pair
I0914 11:56:26.877339   42832 main.go:165] Subcribed to topic bondhome/devices/1407b88f/Open
I0914 11:56:26.877456   42832 main.go:165] Subcribed to topic bondhome/devices/1407b88f/Close
I0914 11:56:26.877484   42832 main.go:165] Subcribed to topic bondhome/devices/1407b88f/Stop
I0914 11:56:26.877561   42832 main.go:165] Subcribed to topic bondhome/devices/1407b88f/Preset
I0914 11:56:26.877706   42832 bpup.go:67] Opened UDP connection to 192.168.1.235:30007 listening at 192.168.1.162:58022
I0914 11:56:26.897741   42832 bpup.go:88] Received handshake response from server: {"B":"ZZDF77575","d":0,"v":"v3.3.19"}

I0914 11:56:41.152612   42832 main.go:153] Message(0): "True" on topic bondhome/devices/1407b88f/Open
I0914 11:56:41.152712   42832 api.go:55] Sending request: PUT http://192.168.1.235/v2/devices/1407b88f/actions/Open body="True"
E0914 11:56:41.256364   42832 main.go:155] Not acking message due to error executing action: expected 2xx response but got: &{400 Bad Request 400 HTTP/1.1 1 1 map[Bond-Flags:[4] Content-Length:[50] Content-Type:[application/json; charset=utf-8]] 0xc00011e940 50 [] false false map[] 0xc0000c8100 <nil>}

**Comment by hi-flyer** [comment]
@ssmall 
I sent the following command. I see the response has a double __ in the response or the single _ . Is that the issue?
curl -H "BOND-Token: xxxxxxxxxxxxxx" -i http://192.168.1.235/v2/devices/1407b88f/actions/Close -X PUT -d "{\"body\":\"true\"}"
HTTP/1.1 200 OK
BOND-Flags: 132
Content-Length: 48
Content-Type: application/json; charset=utf-8

{"body":"true","_":"00000000","__":"00000000"}

**Comment by ssmall** [comment]
The request that you sent with curl is not the same as the request that is causing the issue. According to the logs, the content being received via MQTT is just `True`, not `{ body: true }`. I believe that is the issue you're now seeing.

**Comment by hi-flyer** [comment]
@ssmall 
true is what is sent on mqtt to the broker from my automation system. That always worked. Do I need to send something different like "body":"true" to the broker?

**Comment by hi-flyer** [comment]
from my old logs I captured the following:
 2022/09/11 14:19:58 Message(0): "true" on topic bondhome/devices/1407b88f/Close
 2022/09/11 14:19:58 Sending request: PUT http://192.168.1.235/v2/devices/1407b88f/actions/Close body="true"
 2022/09/11 14:19:59 Publishing to bondhome/devices/1407b88f/state with body: {"open":0,"counter1":14,"counter2":830,"_":"bfb86d13"}

this old message indicates it is publishing and the message line is the same.
is there some other test I can make to clarify the issue?

**Comment by ssmall** [comment]
Good point about not needing `body`. There is another difference. In your most recent logs, it looks the the T is capitalized. So it's `True` instead of `true`. Any idea why that changed?

**Comment by hi-flyer** [comment]
@ssmall 
was looking at code and missed your question. I may have changed in automation but it makes no difference. Ran test with True and same result
I0914 14:41:07.363631   62683 api.go:55] Sending request: PUT http://192.168.1.235/v2/devices/1407b88f/actions/Close body="True"
E0914 14:41:07.429563   62683 main.go:156] Not acking message due to error executing action: expected 2xx response but got: &{400 Bad Request 400 HTTP/1.1 1 1 map[Bond-Flags:[4] Content-Length:[50] Content-Type:[application/json; charset=utf-8]] 0xc000146980 50 [] false false map[] 0xc0000ce000 <nil>}

**Comment by hi-flyer** [comment]
also ran the curl -H "BOND-Token: xxxxxxxxxxxxxx" -i http://192.168.1.235/v2/devices/1407b88f/actions/Close -X PUT -d "{"body":"true"}" with both true and True and got same results

**Comment by hi-flyer** [comment]
@ssmall so in an attempt to better define the issue, I installed tshark and captured the following using tshark -lo -O mqtt command. while I am not sure but it seems the "True" is not being published.

 Frame 58: 105 bytes on wire (840 bits), 105 bytes captured (840 bits) on interface lo, id 0
551 Ethernet II, Src: 00:00:00_00:00:00 (00:00:00:00:00:00), Dst: 00:00:00_00:00:00 (00:00:00:00:00:00)
552 Internet Protocol Version 4, Src: 127.0.0.1, Dst: 127.0.0.1
553 Transmission Control Protocol, Src Port: 38112, Dst Port: 1883, Seq: 1, Ack: 1, Len: 39
554 MQ Telemetry Transport Protocol, Publish Message
555     Header Flags: 0x30, Message Type: Publish Message, QoS Level: At most once delivery (Fire and Forget)
556         0011 .... = Message Type: Publish Message (3)
557         .... 0... = DUP Flag: Not set
558         .... .00. = QoS Level: At most once delivery (Fire and Forget) (0)
559         .... ...0 = Retain: Not set
560     Msg Len: 37
561     Topic Length: 31
562     Topic: bondhome/devices/1407b88f/Close
563     Message: 54727565
564
565 Frame 59: 105 bytes on wire (840 bits), 105 bytes captured (840 bits) on interface lo, id 0
566 Ethernet II, Src: 00:00:00_00:00:00 (00:00:00:00:00:00), Dst: 00:00:00_00:00:00 (00:00:00:00:00:00)
567 Internet Protocol Version 4, Src: 127.0.0.1, Dst: 127.0.0.1
568 Transmission Control Protocol, Src Port: 1883, Dst Port: 46784, Seq: 75, Ack: 564, Len: 39
569 MQ Telemetry Transport Protocol, Publish Message
570     Header Flags: 0x30, Message Type: Publish Message, QoS Level: At most once delivery (Fire and Forget)
571         0011 .... = Message Type: Publish Message (3)
572         .... 0... = DUP Flag: Not set
573         .... .00. = QoS Level: At most once delivery (Fire and Forget) (0)
574         .... ...0 = Retain: Not set
575     Msg Len: 37
576     Topic Length: 31
577     Topic: bondhome/devices/1407b88f/Close
578     Message: 54727565

**Comment by ssmall** [comment]
> also ran the curl -H "BOND-Token: xxxxxxxxxxxxxx" -i http://192.168.1.235/v2/devices/1407b88f/actions/Close -X PUT -d "{"body":"true"}" with both true and True and got same results

Can you try running the following two commands and let me know the results??

## 1. Lowercase t
```
curl -H "BOND-Token: xxxxxxxxxxxxxx" -i http://192.168.1.235/v2/devices/1407b88f/actions/Close -X PUT -d "true"
```

## 2. Uppercase T
```
curl -H "BOND-Token: xxxxxxxxxxxxxx" -i http://192.168.1.235/v2/devices/1407b88f/actions/Close -X PUT -d "True"
```

**Comment by hi-flyer** [comment]
@ssmall  as requested
beckstein@LINUX-E4310-3:~/bondhome-mqtt$ curl -H "BOND-Token: xxxxxxxxxxxxx" -i http://192.168.1.235/v2/devices/1407b88f/actions/Close -X PUT -d "true"
HTTP/1.1 400 Bad Request
BOND-Flags: 4
Content-Length: 54
Content-Type: application/json; charset=utf-8

{"_error_id":747,"_error_msg":"body must be object"}
beckstein@LINUX-E4310-3:~/bondhome-mqtt$ curl -H "BOND-Token: xxxxxxxxxxxx" -i http://192.168.1.235/v2/devices/1407b88f/actions/Close -X PUT -d "True"
HTTP/1.1 400 Bad Request
BOND-Flags: 4
Content-Length: 50
Content-Type: application/json; charset=utf-8

{"_error_id":23,"_error_msg":"json parse error"}

**Comment by ssmall** [comment]
Ok, now we're getting somewhere. The code that generates the request hasn't changed, so my guess at this point is that the latest firmware for the Bond bridge no longer accepts raw values in requests, and instead requires that every request be a JSON object. Thanks for helping debug -- it will take a bit longer to update the code but I'll ping you here when I have the changes ready for you to test.

**Comment by ssmall** [comment]
@hi-flyer I've pushed a potential fix to a new branch. It's not merged in to the main branch yet because it could break other users. Could you do `git fetch` and then `git checkout 5ee2925f06ac1d1668ccfda992298068385c28fb` then try running again?

**Comment by hi-flyer** [comment]
@ssmall 
ok, works with true but fails with True. I can live with this but thought I would inform you. test results below:

go run main.go -logtostderr -v=1 -broker tcp://localhost:1883 -bridge 192.168.1.235 -token xxxxxxxxxxxxxx
I0915 07:18:50.608732  177661 mqtt.go:24] Establishing connection to MQTT broker @ tcp://localhost:1883 using client ID "LINUX-E4310-3"
I0915 07:18:50.611048  177661 main.go:46] Connected to broker @  tcp://localhost:1883
I0915 07:18:50.703721  177661 main.go:117] Got device IDs:  [1407b88f 19aa5d53]
I0915 07:18:50.826881  177661 main.go:128] Discovered device with id "1407b88f": &bondhome.Device{Name:"kitchen", Type:"MS", Location:"Kitchen", Actions:[]string{"Close", "Hold", "Open", "Pair", "Preset", "Stop", "ToggleOpen"}}
I0915 07:18:50.829308  177661 main.go:173] Subcribed to topic bondhome/devices/1407b88f/Open
I0915 07:18:50.829312  177661 main.go:173] Subcribed to topic bondhome/devices/1407b88f/ToggleOpen
I0915 07:18:50.829406  177661 main.go:173] Subcribed to topic bondhome/devices/1407b88f/Hold
I0915 07:18:50.829607  177661 main.go:173] Subcribed to topic bondhome/devices/1407b88f/Close
I0915 07:18:50.829620  177661 main.go:173] Subcribed to topic bondhome/devices/1407b88f/Pair
I0915 07:18:50.829787  177661 main.go:173] Subcribed to topic bondhome/devices/1407b88f/Stop
I0915 07:18:50.829794  177661 main.go:173] Subcribed to topic bondhome/devices/1407b88f/Preset
I0915 07:18:50.912741  177661 main.go:128] Discovered device with id "19aa5d53": &bondhome.Device{Name:"Front Door", Type:"MS", Location:"Kitchen", Actions:[]string{"Close", "Hold", "Open", "Pair", "Preset", "Stop", "ToggleOpen"}}
I0915 07:18:50.913805  177661 main.go:173] Subcribed to topic bondhome/devices/19aa5d53/Close
I0915 07:18:50.913837  177661 main.go:173] Subcribed to topic bondhome/devices/19aa5d53/ToggleOpen
I0915 07:18:50.913962  177661 main.go:173] Subcribed to topic bondhome/devices/19aa5d53/Pair
I0915 07:18:50.913967  177661 main.go:173] Subcribed to topic bondhome/devices/19aa5d53/Hold
I0915 07:18:50.914052  177661 main.go:173] Subcribed to topic bondhome/devices/19aa5d53/Open
I0915 07:18:50.914058  177661 main.go:173] Subcribed to topic bondhome/devices/19aa5d53/Preset
I0915 07:18:50.914183  177661 main.go:173] Subcribed to topic bondhome/devices/19aa5d53/Stop
I0915 07:18:50.914319  177661 bpup.go:67] Opened UDP connection to 192.168.1.235:30007 listening at 192.168.1.162:58898
I0915 07:18:51.067197  177661 bpup.go:88] Received handshake response from server: {"B":"ZZDF77575","d":0,"v":"v3.3.19"}

I0915 07:18:57.265195  177661 main.go:154] Message(0): "true" on topic bondhome/devices/1407b88f/Close
I0915 07:18:57.265271  177661 main.go:158] Message payload "true" is not an object (unmarshaling error was: json: cannot unmarshal bool into Go value of type map[string]interface {}), will be wrapped as object
I0915 07:18:57.265388  177661 api.go:55] Sending request: PUT http://192.168.1.235/v2/devices/1407b88f/actions/Close body="{\"body\": true}"
I0915 07:18:57.659796  177661 bpup.go:125] Received UDP message from server: "{\"B\":\"ZZDF77575\",\"d\":0,\"v\":\"v3.3.19\",\"t\":\"devices/1407b88f/state\",\"i\":\"050000286ed47a56\",\"f\":100,\"s\":200,\"m\":0,\"x\":\"bond\",\"b\":{\"open\":0,\"counter1\":1,\"counter2\":849,\"_\":\"aee3c2da\",\"__\":\"aee3c2da\"}}\n"
I0915 07:18:57.660008  177661 main.go:95] Publishing to bondhome/devices/1407b88f/state with body: {"open":0,"counter1":1,"counter2":849,"_":"aee3c2da","__":"aee3c2da"}
I0915 07:18:57.688296  177661 bpup.go:125] Received UDP message from server: "{\"B\":\"ZZDF77575\",\"d\":0,\"v\":\"v3.3.19\",\"t\":\"devices/1407b88f/actions/Close\",\"i\":\"060000133d8f9936\",\"f\":132,\"s\":200,\"m\":2,\"x\":\"http\",\"b\":{\"body\":true,\"_\":\"00000000\",\"__\":\"00000000\"}}\n"
I0915 07:18:57.688415  177661 main.go:95] Publishing to bondhome/devices/1407b88f/actions/Close with body: {"body":true,"_":"00000000","__":"00000000"}


I0915 07:19:51.092934  177661 bpup.go:125] Received UDP message from server: "{\"B\":\"ZZDF77575\",\"d\":0,\"v\":\"v3.3.19\"}\n"
I0915 07:19:56.251521  177661 main.go:154] Message(0): "True" on topic bondhome/devices/1407b88f/Open
I0915 07:19:56.251586  177661 main.go:158] Message payload "True" is not an object (unmarshaling error was: invalid character 'T' looking for beginning of value), will be wrapped as object
I0915 07:19:56.251774  177661 api.go:55] Sending request: PUT http://192.168.1.235/v2/devices/1407b88f/actions/Open body="{\"body\": True}"
E0915 07:19:56.354256  177661 main.go:163] Not acking message due to error executing action: expected 2xx response but got: &{400 Bad Request 400 HTTP/1.1 1 1 map[Bond-Flags:[4] Content-Length:[50] Content-Type:[application/json; charset=utf-8]] 0xc0001c5200 50 [] false false map[] 0xc000296000 <nil>}
^CW0915 07:20:03.871855  177661 main.go:68] Got interrupt, exiting

**Comment by hi-flyer** [comment]
just noticed there is an unmarshaling error was: json:  
even though it ultimately successful with true.
Understand this may be for backwards compatibility.

**Comment by hi-flyer** [comment]
@ssmall 
another thing I noticed, you asked me to do a git fetch and then git checkout 5ee2925f06ac1d1668ccfda992298068385c28fb which failed as git said it was not a valid url?  this was probably because I download a zip file to activate. I tried the gh command as suggested on the code page but that also failed. ultimately I tried a git clone with the above and that worked. seems the gh does not support clone anymore. I don't really understand but thought I would inform you.

**Comment by hi-flyer** [comment]
I also modified your code slightly on logging. Lines main.go:173, main.go:158, bpup.go:125 to glog.V(2) commands. Reason is wish some logging info as I track that but not quite so much detail. This is not a request to change your code only to inform you.

**Comment by ssmall** [comment]
> ok, works with true but fails with True. I can live with this but thought I would inform you.

Yeah, I don't think there is really anything to be done about that. It's the Bond API that is enforcing the case-sensitivity here and my software is just passing through the value.

> just noticed there is an unmarshaling error was: json:  
> 
> even though it ultimately successful with true.
> 
> Understand this may be for backwards compatibility.

This log line is just for debugging, it is expected.

So it sounds like the issue is resolved for you with the latest changes? Are you able to run normally and confirm that everything is working for you?

**Comment by hi-flyer** [comment]
@ssmall yes it is not running as it should be.
Thank you for all of your time and effort on this. It is much appreciated.

**Comment by hi-flyer** [comment]
Do you need more testing from me or should I close this issue?

**Comment by ssmall** [comment]
Thanks for all your help testing the fix! I will close this issue once I have merged in the changes

**Comment by ssmall** [comment]
The fix for this issue is pushed and has been released as `v1.0.0`: https://github.com/ssmall/bondhome-mqtt/releases/tag/v1.0.0
